{"address":"server.example","connectionKey":"mosh:alice@server.example:2222&via=11111111-2222-3333-4444-555555555555","hostID":"AAAAAAAA-BBBB-CCCC-DDDD-EEEEEEEEEEEE","hostKeyFP":"SHA256:destination","launchMode":"pinnedTmux","name":"production","port":2222,"tmux":"dev","transport":"mosh","user":"alice","v":1,"via":[{"address":"jump.example","hostID":"11111111-2222-3333-4444-555555555555","hostKeyFP":"SHA256:via","name":"bastion","port":22,"transport":"ssh","user":"jump"}]}
